question,is_cached
Jak zapewnić istnienie tylko jednego obiektu danej klasy?,False
Jak klasa potomna przejmuje metody klasy bazowej?,False
Zastosowanie wyrażeń lambda w kodzie.,True
Wyjaśnij zagrożenie SQL Injection.,True
Wyjaśnij pojęcia ciągłej integracji i ciągłego wdrażania.,False
Jak zapewnić istnienie tylko jednego obiektu danej klasy?,False
Zastosowanie wyrażeń lambda w kodzie.,True
Jak klasa potomna przejmuje metody klasy bazowej?,True
Wyjaśnij koncepcję konteneryzacji w Dockerze.,False
Cechy klucza głównego.,False
