question,answer
What is technology used for?,"('Technology is primarily used for **solving human problems, improving efficiency, and facilitating communication across various aspects of modern life.**\n\nPrimary uses and applications can be broadly categorized as:\n\n| Category | Primary Function | Illustrative Example |\n| :--- | :--- | :--- |\n| **Communication** | Connecting individuals and transferring information instantly. | The Internet, smartphones. |\n| **Industry & Production** | Automating processes, increasing output, and standardizing quality. | Robotics in manufacturing, automated supply chains. |\n| **Health & Science** | Advancing medical diagnostics, treatment, and research capabilities. | Diagnostic imaging (CT scans), advanced surgical tools. |\n| **Information Processing** | Collecting, analyzing, storing, and securing vast amounts of data. | Cloud computing, Artificial Intelligence (AI) algorithms. |\n\n**Clarifications:** Technology is not limited to electronics; it fundamentally represents the application of scientific knowledge for practical objectives, encompassing tools, organized systems, and methods spanning both physical (machinery) and non-physical (software) domains.', False, 'None')"
What is information?,"('Information is **data that has been processed, organized, structured, or presented in a given context so as to make it meaningful or useful.**\n\n**Differentiation from Raw Data:**\n*   **Data** refers to raw, unorganized facts, observations, or symbols (e.g., a list of numbers: 10, 25, 18).\n*   **Information** is the interpretation of that data, providing context and reducing uncertainty (e.g., ""The average temperature this week was 18 degrees Celsius"").\n\n**Function within Systems:**\nThe typical function of information within communication or processing systems is to **reduce uncertainty**, enabling informed decision-making, control, and knowledge generation. It is the output of processing and the input for subsequent communication, serving as the basis for feedback and action. Information also possesses characteristics like accuracy, timeliness, and relevance, which determine its utility.', False, 'None')"
Why do people communicate?,"('People communicate **to fulfill fundamental needs related to connection, influence, and knowledge exchange.**\n\nCore motivations for human communication can be categorized into four primary functions:\n\n1.  **Practical/Instrumental:** Communicating to achieve specific goals, coordinate actions, or request/provide necessary information (e.g., giving instructions, making a purchase).\n2.  **Social/Relational:** Communicating to establish, maintain, or dissolve relationships; expressing emotions; and building community (e.g., socializing, conflict resolution).\n3.  **Self-Expression/Identity:** Communicating to define and present oneself to the world, confirm personal values, or simply release feelings (e.g., creative writing, venting frustration).\n4.  **Influence/Persuasion:** Communicating to change the attitudes, beliefs, or behaviors of others (e.g., debating, marketing).\n\n**Functional Purpose in Social Structures:**\nCommunication serves as the essential mechanism for **cohesion and order** in social structures. It enables the creation and maintenance of shared culture, social norms, and institutional frameworks. Effective communication is crucial for organizing groups, facilitating cooperation, and transmitting knowledge across generations.', False, 'None')"
What is a system?,"('A system is **a set of interacting or interdependent components forming an integrated whole.**\n\n**Essential Components and Interaction:**\nSystems are composed of **elements** (components, parts, or subsystems) which, while distinct, are linked by relationships. The role of **interaction** is critical; the components work together toward a common goal or purpose, resulting in properties (known as emergent properties) that are greater than the sum of the individual parts.\n\n**Nature of Boundaries:**\nA system possesses a **boundary** that separates it from its environment. This boundary defines what is inside and outside the system.\n*   **Open Systems** exchange both matter (or energy) and information with their environment (e.g., a living organism, a business organization).\n*   **Closed Systems** exchange only energy, but not matter, with the environment (rarely found perfectly in reality).\n\nClarification: The defining characteristic of a system is that the arrangement and relationship between its components are as important as the components themselves.', False, 'None')"
What is culture?,"('Culture is **the integrated pattern of human knowledge, belief, and behavior that depends upon the capacity for learning and transmitting knowledge to succeeding generations.**\n\n**Key Elements:**\nCulture comprises tangible and intangible elements, including:\n*   **Values:** Shared standards or ideals that define what is good, desirable, or important.\n*   **Beliefs:** Specific ideas that people hold to be true.\n*   **Norms:** Rules and expectations by which a society guides the behavior of its members (further divided into *mores* and *folkways*).\n*   **Symbols:** Anything that carries a particular meaning recognized by people who share a culture (e.g., language, gestures).\n*   **Artifacts:** Physical objects created by a society (material culture).\n\n**Transmission:**\nCulture is transmitted through **socialization** (the process of learning one’s culture) and **enculturation** (the process by which a person learns the requirements of the surrounding culture and acquires values and behaviors appropriate or necessary in that culture). Unlike genetics, culture is learned behavior, making it adaptive.\n\n**Differentiation from Society:**\n**Culture** refers to the shared way of life—the beliefs, practices, and material objects—of a group. **Society** refers to the people who interact in a defined territory and share a common culture. In short, culture is the behavioral content, and society is the structural group that shares that content.', False, 'None')"
How do people solve problems?,"('People solve problems **by employing cognitive processes and structured strategies to bridge the gap between a current state and a desired goal.**\n\n**Common Problem-Solving Methods:**\n\n| Method | Description | Application/Context |\n| :--- | :--- | :--- |\n| **Trial and Error** | Systematic or random attempts until a successful outcome is found. | Simple problems or when information is scarce. |\n| **Algorithms** | Step-by-step procedures guaranteed to find a solution, if one exists. | Mathematical problems, programming logic. |\n| **Heuristics** | Mental shortcuts, rules of thumb, or educated guesses that speed up the process but do not guarantee a correct solution. | Everyday decision-making, complex, novel problems. |\n| **Insight** | A sudden realization of a solution (often preceded by unconscious processing). | Creative solutions, breaking mental sets. |\n\n**Key Stages in the Process:**\nAlthough models vary, problem-solving generally involves four core stages:\n1.  **Preparation:** Identifying and understanding the problem, defining constraints, and collecting information.\n2.  **Production:** Generating potential solutions (using the methods listed above).\n3.  **Judgment/Evaluation:** Testing and evaluating the feasibility and effectiveness of the proposed solutions.\n4.  **Action/Verification:** Implementing the chosen solution and verifying that it successfully resolves the problem.\n\n**Clarification:** Effective problem-solving often relies on the ability to overcome *functional fixedness* (the inability to see a new use for an object beyond its traditional purpose) and *mental sets* (the tendency to approach problems in ways that worked in the past).', False, 'None')"
What is an algorithm?,"('An algorithm is **a finite, well-defined, step-by-step sequence of unambiguous instructions designed to solve a specific class of problems or perform a specific computation.**\n\n**Mandatory Properties:**\nFor a procedure to be considered a true algorithm, it must satisfy several mandatory properties:\n1.  **Input:** Zero or more externally supplied quantities.\n2.  **Output:** At least one quantity produced as the result.\n3.  **Definiteness:** Each step must be precisely and unambiguously specified.\n4.  **Finiteness:** The algorithm must terminate after a finite number of steps for all cases.\n5.  **Effectiveness:** Each operation must be sufficiently basic that it can be carried out exactly and in a finite amount of time.\n\n**Fundamental Function in Computing:**\nThe fundamental function of an algorithm in modern computing is to serve as the **blueprint for processing data.** Algorithms dictate how software organizes, manipulates, and analyzes input to produce desired output (e.g., sorting a list of names, calculating a route, searching a database, or compressing a file). They are the core logic upon which all computational tasks are built.', False, 'None')"
What is knowledge?,"('Knowledge is **the awareness or understanding of facts, truths, or principles gained through experience, education, or perception.**\n\n**Classical Tripartite Conditions (Justified True Belief):**\nPhilosophically, knowledge is classically defined by the following three necessary and jointly sufficient conditions:\n1.  **Belief (B):** The subject must believe the proposition ($P$).\n2.  **Truth (T):** The proposition ($P$) must actually be true in reality.\n3.  **Justification (J):** The subject must have adequate evidence or proper grounds for believing that the proposition ($P$) is true.\n\nThis definition summarizes knowledge as **Justified True Belief (JTB)**.\n\n**Primary Role in Decision-Making:**\nThe primary role of knowledge in decision-making is to **reduce uncertainty and structure problems.** Knowledge provides the necessary context, constraints, and predictive models (based on past information) that allow individuals or systems to evaluate potential outcomes, assess risks, and select the course of action most likely to achieve the desired goal.', False, 'None')"
What is money?,"('Money is **any item or verifiable record that is generally accepted as payment for goods and services and repayment of debts in a particular country or socio-economic context.**\n\n**Three Essential Functions:**\nMoney serves three primary functions in an economy:\n1.  **Medium of Exchange:** It can be used to purchase goods and services, eliminating the inefficiencies of bartering.\n2.  **Unit of Account:** It provides a standard measure or common denominator for stating the prices of goods and services, making value comparable.\n3.  **Store of Value:** It holds its purchasing power over time, allowing people to save wealth and defer consumption (though this function is affected by inflation).\n\n**Commodity vs. Fiat Forms:**\n*   **Commodity Money** has intrinsic value based on the material it is made from (e.g., gold, silver, or tobacco).\n*   **Fiat Money** has no intrinsic value; its value is derived solely from a government decree (fiat) that it is legal tender. Modern currencies (dollars, euros) are fiat money, relying on public confidence and government stability.', False, 'None')"
Why do people make decisions?,"('People make decisions **to resolve discrepancies between a current state and a desired future state, ultimately aiming to optimize outcomes and achieve objectives.**\n\n**Conditions Triggering Choice:**\nDecision-making is triggered by several conditions, most notably:\n*   **Necessity:** The existence of a problem that requires resolution (e.g., a choice must be made because inaction leads to failure).\n*   **Opportunity:** The potential for gain or improvement over the status quo.\n*   **Uncertainty/Risk:** The presence of multiple possible outcomes, requiring assessment of probabilities and potential losses.\n*   **Scarcity:** The allocation of limited resources (time, money, effort) among competing alternatives.\n\n**Categorization of General Goals/Outcomes:**\nDecisions are generally driven by the goal of:\n1.  **Maximization:** Seeking the best possible outcome (e.g., maximizing profit, maximizing happiness).\n2.  **Satisficing:** Selecting the first acceptable option that meets a minimum set of criteria, rather than searching exhaustively for the optimal one (a common approach under time constraints).\n3.  **Risk Management:** Minimizing potential negative consequences or losses.\n4.  **Goal Achievement:** Directing effort and resources toward the fulfillment of defined personal or organizational objectives.\n\n**Clarification:** Human decisions are not always perfectly rational; they are heavily influenced by cognitive biases, emotions, and heuristic shortcuts (System 1 thinking), particularly when time pressure or complexity is high.', False, 'None')"
What is communication?,"('People communicate **to fulfill fundamental needs related to connection, influence, and knowledge exchange.**\n\nCore motivations for human communication can be categorized into four primary functions:\n\n1.  **Practical/Instrumental:** Communicating to achieve specific goals, coordinate actions, or request/provide necessary information (e.g., giving instructions, making a purchase).\n2.  **Social/Relational:** Communicating to establish, maintain, or dissolve relationships; expressing emotions; and building community (e.g., socializing, conflict resolution).\n3.  **Self-Expression/Identity:** Communicating to define and present oneself to the world, confirm personal values, or simply release feelings (e.g., creative writing, venting frustration).\n4.  **Influence/Persuasion:** Communicating to change the attitudes, beliefs, or behaviors of others (e.g., debating, marketing).\n\n**Functional Purpose in Social Structures:**\nCommunication serves as the essential mechanism for **cohesion and order** in social structures. It enables the creation and maintenance of shared culture, social norms, and institutional frameworks. Effective communication is crucial for organizing groups, facilitating cooperation, and transmitting knowledge across generations.', True, 'None')"
What is art?,"('Art is **the expression or application of human creative skill and imagination, typically in a visual form such as painting or sculpture, producing works to be appreciated primarily for their beauty or emotional power.**\n\n**Primary Functions:**\nThe primary functions of art are diverse but commonly include:\n1.  **Aesthetic Function:** To provide sensory pleasure and elicit appreciation for beauty, form, or composition.\n2.  **Expressive Function:** To communicate emotions, ideas, or profound truths that may not be easily expressed through ordinary language.\n3.  **Social/Cultural Function:** To transmit cultural values, record history, or critique social and political structures.\n4.  **Therapeutic Function:** To provide healing or self-reflection for both the creator and the viewer.\n\n**Distinction between Fine Arts and Applied Arts:**\n*   **Fine Arts** are typically defined as creations valued purely for intellectual, aesthetic, or imaginative stimulation. They traditionally include painting, sculpture, and drawing, and serve no utilitarian function beyond contemplation.\n*   **Applied Arts** involve the application of design and decoration to everyday objects to make them aesthetically pleasing and useful. Examples include architecture, graphic design, and industrial design.\n\n**Clarification:** The definition of art is constantly debated, evolving, and highly subjective, making its interpretation context-dependent.', False, 'None')"
Why do people need knowledge?,"('Knowledge is **the awareness or understanding of facts, truths, or principles gained through experience, education, or perception.**\n\n**Classical Tripartite Conditions (Justified True Belief):**\nPhilosophically, knowledge is classically defined by the following three necessary and jointly sufficient conditions:\n1.  **Belief (B):** The subject must believe the proposition ($P$).\n2.  **Truth (T):** The proposition ($P$) must actually be true in reality.\n3.  **Justification (J):** The subject must have adequate evidence or proper grounds for believing that the proposition ($P$) is true.\n\nThis definition summarizes knowledge as **Justified True Belief (JTB)**.\n\n**Primary Role in Decision-Making:**\nThe primary role of knowledge in decision-making is to **reduce uncertainty and structure problems.** Knowledge provides the necessary context, constraints, and predictive models (based on past information) that allow individuals or systems to evaluate potential outcomes, assess risks, and select the course of action most likely to achieve the desired goal.', True, 'None')"
What is law?,"('Law is **a system of rules and guidelines enforced by governmental or communal institutions to govern behavior.**\n\n**Primary Functions:**\nThe primary functions of law within a society include:\n1.  **Establishing Order:** Providing a framework of predictable expectations and rules for daily life and interactions.\n2.  **Resolving Disputes:** Offering formal mechanisms (courts and arbitration) for settling disagreements between individuals, organizations, or the government.\n3.  **Protecting Rights and Liberties:** Safeguarding individual freedoms and ensuring fairness and equality.\n4.  **Facilitating Social Change:** Acting as a catalyst or a brake on societal transformation.\n\n**Differentiation from Moral or Ethical Rules:**\nWhile often overlapping, law and morality are distinct:\n*   **Law** is enforced externally by the state, backed by coercive sanctions (fines, imprisonment). Its violation is a legal offense.\n*   **Morality/Ethics** refers to a system of personal or communal values concerning right and wrong. Its violation results in internal guilt or social stigma, but generally not state punishment. For instance, lying may be immoral, but it is only illegal under specific circumstances (e.g., perjury).\n\n**Clarification:** Legal systems are typically classified into two main types: **Common Law** (based on judicial precedent) and **Civil Law** (based on codified statutes).', False, 'None')"
What is time?,"(""Time is **the indefinite continued progress of existence and events in the past, present, and future regarded as a whole.**\n\n**Role in Measurement:**\nConceptually, time allows for the **sequencing of events** and the **measurement of duration** between them. In physics, time is defined operationally by the process used to measure it (e.g., atomic clocks measure the frequency of radiation transitions). The standard unit of time is the second. Time is universally used to calculate rates of change, such as speed, acceleration, and flow.\n\n**Relationship with Space (Modern Physics):**\nIn classical physics, time was viewed as absolute and universal. However, under Albert Einstein's theories of special and general relativity, time is integrated with the three dimensions of space to form a four-dimensional manifold known as **spacetime**. Key implications include:\n*   **Relativity:** Time is relative; its flow can be altered by gravity and speed (time dilation).\n*   **The Arrow of Time:** Time generally progresses only in one direction—from the past, through the present, and into the future—a concept often linked to increasing entropy (disorder) in the universe."", False, 'None')"
What is the economy?,"('The economy is **the system of activities related to the production, distribution, exchange, and consumption of goods and services in a particular country or region.**\n\n**Fundamental Function:**\nThe fundamental function of an economy is **resource allocation**—determining *what* goods and services are produced, *how* they are produced, and *for whom* they are produced, especially in the context of scarcity.\n\n**Key Constituent Activities:**\nThe three key activities that define an economy are:\n1.  **Production:** The creation of goods and services using land, labor, and capital.\n2.  **Distribution:** The process by which goods and services reach the final consumer (e.g., trade, commerce, supply chains).\n3.  **Consumption:** The use of goods and services to satisfy needs and wants.\n\n**Major Economic Systems Differentiation:**\n*   **Market Economy (Capitalism):** Decisions are decentralized and based primarily on supply and demand, with private ownership dominating resources.\n*   **Command Economy (Socialism/Communism):** Decisions are centralized and planned by the government, which primarily owns the means of production.\n*   **Mixed Economy:** Contains elements of both market and command systems, with private enterprise existing alongside significant government regulation and public services (most modern nations use a mixed system).', False, 'None')"
What is technology?,"('Technology is primarily used for **solving human problems, improving efficiency, and facilitating communication across various aspects of modern life.**\n\nPrimary uses and applications can be broadly categorized as:\n\n| Category | Primary Function | Illustrative Example |\n| :--- | :--- | :--- |\n| **Communication** | Connecting individuals and transferring information instantly. | The Internet, smartphones. |\n| **Industry & Production** | Automating processes, increasing output, and standardizing quality. | Robotics in manufacturing, automated supply chains. |\n| **Health & Science** | Advancing medical diagnostics, treatment, and research capabilities. | Diagnostic imaging (CT scans), advanced surgical tools. |\n| **Information Processing** | Collecting, analyzing, storing, and securing vast amounts of data. | Cloud computing, Artificial Intelligence (AI) algorithms. |\n\n**Clarifications:** Technology is not limited to electronics; it fundamentally represents the application of scientific knowledge for practical objectives, encompassing tools, organized systems, and methods spanning both physical (machinery) and non-physical (software) domains.', True, 'None')"
What is ethics?,"('Ethics is **a branch of philosophy that involves systematizing, defending, and recommending concepts of right and wrong behavior.**\n\n**Differentiation from Morality:**\nWhile often used interchangeably in common speech, philosophers typically draw a distinction:\n*   **Morality** refers to the actual practices, habits, and codes of conduct concerning right and wrong that are held by individuals or groups. Morality answers the question, ""What should I do?""\n*   **Ethics** is the theoretical, critical, and rational study of morality. It investigates the foundations, principles, and rules underlying moral systems. Ethics answers the question, ""Why should I do it?""\n\n**Primary Sub-disciplines (Branches):**\n1.  **Metaethics:** The most abstract branch, which investigates the nature of moral judgment and the meaning of moral terms (e.g., What does ""good"" mean? Is morality objective or relative?).\n2.  **Normative Ethics:** Seeks to establish practical moral standards or rules that regulate right and wrong conduct (e.g., Utilitarianism, Deontology, Virtue Ethics).\n3.  **Applied Ethics:** Examines specific, controversial issues and attempts to apply moral standards to real-world problems (e.g., Bioethics, Business Ethics, Environmental Ethics).', False, 'None')"
What is space?,"(""Space is **the boundless three-dimensional extent in which objects and events have relative position and direction.**\n\n**Role as a Container:**\nConceptually, space serves as the container for all physical reality, defining the location, size, and motion of objects. It is the framework within which phenomena occur, allowing for measurement in terms of length, width, and height.\n\n**Relationship with Time (Modern Physics):**\nIn modern physics, specifically Einstein’s theories of relativity, space is not an empty, static container. Instead, it is inextricably linked with time, forming a unified, four-dimensional continuum known as **spacetime**. Key aspects of this relationship include:\n*   **Curvature:** Mass and energy cause spacetime to curve, and this curvature is what we perceive as gravity.\n*   **Relativity:** Measurements of space (distance) and time (duration) are relative to the observer's motion and speed.\n\n**Clarification:** In cosmology, the universe is defined not just by the space it contains, but by the properties of the space itself, which is currently understood to be expanding, accelerating the distances between galaxies."", False, 'None')"
