question,is_cached
What does the concept of a vector mean?,True
What are the applications of a definite integral?,True
What does mathematical induction allow us to demonstrate?,True
How is a function defined?,True
What is the logarithm of a number?,True
What does a definite integral mean in mathematical analysis?,True
For what purpose is a definite integral used?,True
What does a definite integral mean in mathematical analysis?,True
What does the Pythagorean theorem state?,True
How is a function defined?,True
